question_id,domain_id,workflow_id,step_id,question_text,question_type,question_intent,score_1_guidance,score_3_guidance,score_5_guidance,primary_driver,secondary_driver,linked_metric,issue_type,recommendation_id,action_id,owner_role,automation_flag,ai_flag,roadmap_phase,priority_weight,audit_scoring_focus,evidence_examples,customer_impact_if_weak,severity_band_logic
Q-D06-05-02,D06,WF-D06-05,ST-D06-05-02,"Does escalation management run consistently in practice, meeting expected turnaround, quality, and handoff standards so that overdue accounts are followed up consistently and escalated on time without avoidable delay, rework, or dependence on individual heroics?",quality,execution,"Escalation Management is executed inconsistently and is regularly affected by inconsistent follow-up, poor debtor contact, and overdue balances aging unnecessarily. Work is often delayed, reworked, or completed through manual chasing, with limited confidence in turnaround, quality, or downstream readiness.","Escalation Management usually happens, but performance is still uneven. The team can complete routine work, yet exceptions, delays, quality misses, or inconsistent adherence to standards still create friction often enough to affect business performance.","Escalation Management runs predictably and at the expected quality level. Turnaround, handoffs, and exception handling are controlled, and teams rarely need to rely on ad hoc workarounds to complete the workflow successfully.",Collection Follow-Up Speed,Payment Terms Discipline,Bad Debt / Collections Leakage,inconsistent_workflow_execution,REC-D06-05-02,ACT-D06-05-02,Credit Control / Finance,Yes,No,Phase 1,High,"Look for evidence of real operating discipline in escalation management, including turnaround, quality, rework, SLA adherence, and exception handling.","collections playbook, follow-up schedule, and aged debt tracker","If weak, day-to-day performance in escalation management creates avoidable delay, rework, and customer or commercial friction.",Scores 1-2 = Critical / Weak; Score 3 = Developing; Scores 4-5 = Strong / Managed
Q-D06-05-03,D06,WF-D06-05,ST-D06-05-03,"Is escalation management controlled through defined KPIs, timely exception visibility, and management review so issues are identified early and corrected before they materially affect bad debt / collections leakage?",control,visibility_control,"The business has weak visibility over escalation management. KPIs such as DSO, collections effectiveness index, and promise-to-pay kept rate are absent, unreliable, or reviewed too late, so issues are usually discovered after they have already affected performance, customers, or revenue.","Basic reporting exists for escalation management, but KPI definitions, data quality, review cadence, or action follow-through are not yet strong enough to provide full control. Some issues are surfaced in time, but others still remain hidden or unresolved for too long.","Escalation Management is actively controlled through trusted KPIs such as DSO, collections effectiveness index, and promise-to-pay kept rate, regular review, clear thresholds, and owned corrective actions. Exceptions are visible early and leaders can intervene before the issue becomes material.",Collection Follow-Up Speed,Payment Terms Discipline,Bad Debt / Collections Leakage,weak_workflow_visibility_and_control,REC-D06-05-03,ACT-D06-05-03,Credit Control / Finance,Yes,Yes,Phase 2,High,"Look for trusted KPI visibility over escalation management, including metric definitions, review cadence, escalation, and closure of corrective actions.","collections playbook, follow-up schedule, and aged debt tracker","If weak, leaders cannot see performance issues in escalation management early enough to protect bad debt / collections leakage.",Scores 1-2 = Critical / Weak; Score 3 = Developing; Scores 4-5 = Strong / Managed
Q-D06-06-01,D06,WF-D06-06,ST-D06-06-01,"Is bad debt review designed as a clear end-to-end operating process—with documented scope, trigger points, required inputs, decision rights, systems, and ownership—so that aged debt is reviewed objectively, provisioned appropriately, and fed back into prevention?",process,definition,"There is no single agreed operating design for bad debt review. Key elements such as write-off criteria, provision review, escalation rights, and feedback loop to prevention are unclear, poorly documented, or owned informally, and evidence such as bad debt review pack, provision policy, and write-off approvals is missing, outdated, or not used in practice.","A baseline design exists for bad debt review, but it is not yet complete or consistently adopted. Some ownership, documentation, or handoff rules are defined, but teams still rely on local workarounds or individual interpretation in important areas.","Bad Debt Review is defined as a controlled end-to-end process. Scope, triggers, entry and exit criteria, ownership, decision rights, system steps, and handoffs are documented, current, and used consistently by the teams involved.",Credit Control,Customer Payment Behaviour,Bad Debt / Collections Leakage,unclear_workflow_definition,REC-D06-06-01,ACT-D06-06-01,Credit Control / Finance,No,No,Phase 2,High,"Look for documented standards, ownership, decision rights, entry/exit criteria, required systems, and handoff rules for bad debt review.","bad debt review pack, provision policy, and write-off approvals","If weak, bad debt review becomes dependent on tribal knowledge and makes it harder to scale with strong cash conversion, collections discipline, and credit risk control.",Scores 1-2 = Critical / Weak; Score 3 = Developing; Scores 4-5 = Strong / Managed
Q-D06-06-02,D06,WF-D06-06,ST-D06-06-02,"Does bad debt review run consistently in practice, meeting expected turnaround, quality, and handoff standards so that bad debt decisions are timely, evidence-based, and linked to upstream corrective action without avoidable delay, rework, or dependence on individual heroics?",quality,execution,"Bad Debt Review is executed inconsistently and is regularly affected by debt sits unresolved too long, provisions lag reality, and root causes are not corrected. Work is often delayed, reworked, or completed through manual chasing, with limited confidence in turnaround, quality, or downstream readiness.","Bad Debt Review usually happens, but performance is still uneven. The team can complete routine work, yet exceptions, delays, quality misses, or inconsistent adherence to standards still create friction often enough to affect business performance.","Bad Debt Review runs predictably and at the expected quality level. Turnaround, handoffs, and exception handling are controlled, and teams rarely need to rely on ad hoc workarounds to complete the workflow successfully.",Credit Control,Customer Payment Behaviour,Bad Debt / Collections Leakage,inconsistent_workflow_execution,REC-D06-06-02,ACT-D06-06-02,Credit Control / Finance,Yes,No,Phase 1,High,"Look for evidence of real operating discipline in bad debt review, including turnaround, quality, rework, SLA adherence, and exception handling.","bad debt review pack, provision policy, and write-off approvals","If weak, day-to-day performance in bad debt review creates avoidable delay, rework, and customer or commercial friction.",Scores 1-2 = Critical / Weak; Score 3 = Developing; Scores 4-5 = Strong / Managed
Q-D06-06-03,D06,WF-D06-06,ST-D06-06-03,"Is bad debt review controlled through defined KPIs, timely exception visibility, and management review so issues are identified early and corrected before they materially affect bad debt / collections leakage?",control,visibility_control,"The business has weak visibility over bad debt review. KPIs such as bad debt rate, recovery rate, and write-off aging are absent, unreliable, or reviewed too late, so issues are usually discovered after they have already affected performance, customers, or revenue.","Basic reporting exists for bad debt review, but KPI definitions, data quality, review cadence, or action follow-through are not yet strong enough to provide full control. Some issues are surfaced in time, but others still remain hidden or unresolved for too long.","Bad Debt Review is actively controlled through trusted KPIs such as bad debt rate, recovery rate, and write-off aging, regular review, clear thresholds, and owned corrective actions. Exceptions are visible early and leaders can intervene before the issue becomes material.",Credit Control,Customer Payment Behaviour,Bad Debt / Collections Leakage,weak_workflow_visibility_and_control,REC-D06-06-03,ACT-D06-06-03,Credit Control / Finance,Yes,Yes,Phase 2,High,"Look for trusted KPI visibility over bad debt review, including metric definitions, review cadence, escalation, and closure of corrective actions.","bad debt review pack, provision policy, and write-off approvals","If weak, leaders cannot see performance issues in bad debt review early enough to protect bad debt / collections leakage.",Scores 1-2 = Critical / Weak; Score 3 = Developing; Scores 4-5 = Strong / Managed
Q-D07-01-01,D07,WF-D07-01,ST-D07-01-01,"Is customer onboarding success designed as a clear end-to-end operating process—with documented scope, trigger points, required inputs, decision rights, systems, and ownership—so that customers complete early setup and reach first value quickly?",process,definition,"There is no single agreed operating design for customer onboarding success. Key elements such as activation plan, responsibilities, customer milestones, and readiness criteria are unclear, poorly documented, or owned informally, and evidence such as onboarding plan, customer kickoff template, and go-live checklist is missing, outdated, or not used in practice.","A baseline design exists for customer onboarding success, but it is not yet complete or consistently adopted. Some ownership, documentation, or handoff rules are defined, but teams still rely on local workarounds or individual interpretation in important areas.","Customer Onboarding Success is defined as a controlled end-to-end process. Scope, triggers, entry and exit criteria, ownership, decision rights, system steps, and handoffs are documented, current, and used consistently by the teams involved.",Customer Satisfaction,Product Adoption,Revenue Churn Leakage,unclear_workflow_definition,REC-D07-01-01,ACT-D07-01-01,Customer Success / Account Management,No,No,Phase 2,High,"Look for documented standards, ownership, decision rights, entry/exit criteria, required systems, and handoff rules for customer onboarding success.","onboarding plan, customer kickoff template, and go-live checklist","If weak, customer onboarding success becomes dependent on tribal knowledge and makes it harder to scale with strong customer value realization, retention, and account growth.",Scores 1-2 = Critical / Weak; Score 3 = Developing; Scores 4-5 = Strong / Managed
Q-D07-01-02,D07,WF-D07-01,ST-D07-01-02,"Does customer onboarding success run consistently in practice, meeting expected turnaround, quality, and handoff standards so that customers move from sale to first value quickly with structured communication and task completion without avoidable delay, rework, or dependence on individual heroics?",quality,execution,"Customer Onboarding Success is executed inconsistently and is regularly affected by slow activation, unclear ownership, missed setup tasks, and poor early customer experience. Work is often delayed, reworked, or completed through manual chasing, with limited confidence in turnaround, quality, or downstream readiness.","Customer Onboarding Success usually happens, but performance is still uneven. The team can complete routine work, yet exceptions, delays, quality misses, or inconsistent adherence to standards still create friction often enough to affect business performance.","Customer Onboarding Success runs predictably and at the expected quality level. Turnaround, handoffs, and exception handling are controlled, and teams rarely need to rely on ad hoc workarounds to complete the workflow successfully.",Customer Satisfaction,Product Adoption,Revenue Churn Leakage,inconsistent_workflow_execution,REC-D07-01-02,ACT-D07-01-02,Customer Success / Account Management,Yes,No,Phase 1,High,"Look for evidence of real operating discipline in customer onboarding success, including turnaround, quality, rework, SLA adherence, and exception handling.","onboarding plan, customer kickoff template, and go-live checklist","If weak, day-to-day performance in customer onboarding success creates avoidable delay, rework, and customer or commercial friction.",Scores 1-2 = Critical / Weak; Score 3 = Developing; Scores 4-5 = Strong / Managed
Q-D07-01-03,D07,WF-D07-01,ST-D07-01-03,"Is customer onboarding success controlled through defined KPIs, timely exception visibility, and management review so issues are identified early and corrected before they materially affect revenue churn leakage?",control,visibility_control,"The business has weak visibility over customer onboarding success. KPIs such as time to go-live, time to first value, and onboarding completion rate are absent, unreliable, or reviewed too late, so issues are usually discovered after they have already affected performance, customers, or revenue.","Basic reporting exists for customer onboarding success, but KPI definitions, data quality, review cadence, or action follow-through are not yet strong enough to provide full control. Some issues are surfaced in time, but others still remain hidden or unresolved for too long.","Customer Onboarding Success is actively controlled through trusted KPIs such as time to go-live, time to first value, and onboarding completion rate, regular review, clear thresholds, and owned corrective actions. Exceptions are visible early and leaders can intervene before the issue becomes material.",Customer Satisfaction,Product Adoption,Revenue Churn Leakage,weak_workflow_visibility_and_control,REC-D07-01-03,ACT-D07-01-03,Customer Success / Account Management,Yes,Yes,Phase 2,High,"Look for trusted KPI visibility over customer onboarding success, including metric definitions, review cadence, escalation, and closure of corrective actions.","onboarding plan, customer kickoff template, and go-live checklist","If weak, leaders cannot see performance issues in customer onboarding success early enough to protect revenue churn leakage.",Scores 1-2 = Critical / Weak; Score 3 = Developing; Scores 4-5 = Strong / Managed
Q-D07-02-01,D07,WF-D07-02,ST-D07-02-01,"Is product / service adoption designed as a clear end-to-end operating process—with documented scope, trigger points, required inputs, decision rights, systems, and ownership—so that customers use the product or service deeply enough to receive ongoing value?",process,definition,"There is no single agreed operating design for product / service adoption. Key elements such as success milestones, adoption measures, ownership, and intervention triggers are unclear, poorly documented, or owned informally, and evidence such as success plan, health score logic, and engagement plan is missing, outdated, or not used in practice.","A baseline design exists for product / service adoption, but it is not yet complete or consistently adopted. Some ownership, documentation, or handoff rules are defined, but teams still rely on local workarounds or individual interpretation in important areas.","Product / Service Adoption is defined as a controlled end-to-end process. Scope, triggers, entry and exit criteria, ownership, decision rights, system steps, and handoffs are documented, current, and used consistently by the teams involved.",Product Adoption,Customer Value Realization,Revenue Churn Leakage,unclear_workflow_definition,REC-D07-02-01,ACT-D07-02-01,Customer Success / Account Management,No,No,Phase 2,High,"Look for documented standards, ownership, decision rights, entry/exit criteria, required systems, and handoff rules for product / service adoption.","success plan, health score logic, and engagement plan","If weak, product / service adoption becomes dependent on tribal knowledge and makes it harder to scale with strong customer value realization, retention, and account growth.",Scores 1-2 = Critical / Weak; Score 3 = Developing; Scores 4-5 = Strong / Managed
Q-D07-02-02,D07,WF-D07-02,ST-D07-02-02,"Does product / service adoption run consistently in practice, meeting expected turnaround, quality, and handoff standards so that customers are guided to value through structured engagement and proactive follow-up without avoidable delay, rework, or dependence on individual heroics?",quality,execution,"Product / Service Adoption is executed inconsistently and is regularly affected by customers go quiet after sale, value is delayed, and churn risk becomes visible too late. Work is often delayed, reworked, or completed through manual chasing, with limited confidence in turnaround, quality, or downstream readiness.","Product / Service Adoption usually happens, but performance is still uneven. The team can complete routine work, yet exceptions, delays, quality misses, or inconsistent adherence to standards still create friction often enough to affect business performance.","Product / Service Adoption runs predictably and at the expected quality level. Turnaround, handoffs, and exception handling are controlled, and teams rarely need to rely on ad hoc workarounds to complete the workflow successfully.",Product Adoption,Customer Value Realization,Revenue Churn Leakage,inconsistent_workflow_execution,REC-D07-02-02,ACT-D07-02-02,Customer Success / Account Management,Yes,No,Phase 1,High,"Look for evidence of real operating discipline in product / service adoption, including turnaround, quality, rework, SLA adherence, and exception handling.","success plan, health score logic, and engagement plan","If weak, day-to-day performance in product / service adoption creates avoidable delay, rework, and customer or commercial friction.",Scores 1-2 = Critical / Weak; Score 3 = Developing; Scores 4-5 = Strong / Managed
Q-D07-02-03,D07,WF-D07-02,ST-D07-02-03,"Is product / service adoption controlled through defined KPIs, timely exception visibility, and management review so issues are identified early and corrected before they materially affect revenue churn leakage?",control,visibility_control,"The business has weak visibility over product / service adoption. KPIs such as time to value, adoption depth, and health score coverage are absent, unreliable, or reviewed too late, so issues are usually discovered after they have already affected performance, customers, or revenue.","Basic reporting exists for product / service adoption, but KPI definitions, data quality, review cadence, or action follow-through are not yet strong enough to provide full control. Some issues are surfaced in time, but others still remain hidden or unresolved for too long.","Product / Service Adoption is actively controlled through trusted KPIs such as time to value, adoption depth, and health score coverage, regular review, clear thresholds, and owned corrective actions. Exceptions are visible early and leaders can intervene before the issue becomes material.",Product Adoption,Customer Value Realization,Revenue Churn Leakage,weak_workflow_visibility_and_control,REC-D07-02-03,ACT-D07-02-03,Customer Success / Account Management,Yes,Yes,Phase 2,High,"Look for trusted KPI visibility over product / service adoption, including metric definitions, review cadence, escalation, and closure of corrective actions.","success plan, health score logic, and engagement plan","If weak, leaders cannot see performance issues in product / service adoption early enough to protect revenue churn leakage.",Scores 1-2 = Critical / Weak; Score 3 = Developing; Scores 4-5 = Strong / Managed
Q-D07-03-01,D07,WF-D07-03,ST-D07-03-01,"Is success management designed as a clear end-to-end operating process—with documented scope, trigger points, required inputs, decision rights, systems, and ownership—so that customer health, risks, and opportunities are actively managed throughout the lifecycle?",process,definition,"There is no single agreed operating design for success management. Key elements such as success milestones, adoption measures, ownership, and intervention triggers are unclear, poorly documented, or owned informally, and evidence such as success plan, health score logic, and engagement plan is missing, outdated, or not used in practice.","A baseline design exists for success management, but it is not yet complete or consistently adopted. Some ownership, documentation, or handoff rules are defined, but teams still rely on local workarounds or individual interpretation in important areas.","Success Management is defined as a controlled end-to-end process. Scope, triggers, entry and exit criteria, ownership, decision rights, system steps, and handoffs are documented, current, and used consistently by the teams involved.",Customer Satisfaction,Renewal Engagement,Revenue Churn Leakage,unclear_workflow_definition,REC-D07-03-01,ACT-D07-03-01,Customer Success / Account Management,No,No,Phase 2,High,"Look for documented standards, ownership, decision rights, entry/exit criteria, required systems, and handoff rules for success management.","success plan, health score logic, and engagement plan","If weak, success management becomes dependent on tribal knowledge and makes it harder to scale with strong customer value realization, retention, and account growth.",Scores 1-2 = Critical / Weak; Score 3 = Developing; Scores 4-5 = Strong / Managed
Q-D07-03-02,D07,WF-D07-03,ST-D07-03-02,"Does success management run consistently in practice, meeting expected turnaround, quality, and handoff standards so that customers are guided to value through structured engagement and proactive follow-up without avoidable delay, rework, or dependence on individual heroics?",quality,execution,"Success Management is executed inconsistently and is regularly affected by customers go quiet after sale, value is delayed, and churn risk becomes visible too late. Work is often delayed, reworked, or completed through manual chasing, with limited confidence in turnaround, quality, or downstream readiness.","Success Management usually happens, but performance is still uneven. The team can complete routine work, yet exceptions, delays, quality misses, or inconsistent adherence to standards still create friction often enough to affect business performance.","Success Management runs predictably and at the expected quality level. Turnaround, handoffs, and exception handling are controlled, and teams rarely need to rely on ad hoc workarounds to complete the workflow successfully.",Customer Satisfaction,Renewal Engagement,Revenue Churn Leakage,inconsistent_workflow_execution,REC-D07-03-02,ACT-D07-03-02,Customer Success / Account Management,Yes,No,Phase 1,High,"Look for evidence of real operating discipline in success management, including turnaround, quality, rework, SLA adherence, and exception handling.","success plan, health score logic, and engagement plan","If weak, day-to-day performance in success management creates avoidable delay, rework, and customer or commercial friction.",Scores 1-2 = Critical / Weak; Score 3 = Developing; Scores 4-5 = Strong / Managed
Q-D07-03-03,D07,WF-D07-03,ST-D07-03-03,"Is success management controlled through defined KPIs, timely exception visibility, and management review so issues are identified early and corrected before they materially affect revenue churn leakage?",control,visibility_control,"The business has weak visibility over success management. KPIs such as time to value, adoption depth, and health score coverage are absent, unreliable, or reviewed too late, so issues are usually discovered after they have already affected performance, customers, or revenue.","Basic reporting exists for success management, but KPI definitions, data quality, review cadence, or action follow-through are not yet strong enough to provide full control. Some issues are surfaced in time, but others still remain hidden or unresolved for too long.","Success Management is actively controlled through trusted KPIs such as time to value, adoption depth, and health score coverage, regular review, clear thresholds, and owned corrective actions. Exceptions are visible early and leaders can intervene before the issue becomes material.",Customer Satisfaction,Renewal Engagement,Revenue Churn Leakage,weak_workflow_visibility_and_control,REC-D07-03-03,ACT-D07-03-03,Customer Success / Account Management,Yes,Yes,Phase 2,High,"Look for trusted KPI visibility over success management, including metric definitions, review cadence, escalation, and closure of corrective actions.","success plan, health score logic, and engagement plan","If weak, leaders cannot see performance issues in success management early enough to protect revenue churn leakage.",Scores 1-2 = Critical / Weak; Score 3 = Developing; Scores 4-5 = Strong / Managed
